{
  "id": "pyrion-forge-trial-of-creation",
  "title": "The Trial of Creative Fire - Pyrion's Forge",
  "governing_god": "pyrion",
  "location": {
    "island": "pyrion-forge",
    "specific_site": "The Great Forge Chamber",
    "coordinates": {
      "x": 0,
      "y": 0,
      "z": 0
    },
    "accessibility": "public"
  },
  "trial_structure": {
    "activation_trigger": "Approaching the Great Forge while experiencing divine decay from Pyrion's influence",
    "challenge_type": "hybrid",
    "difficulty_scaling": "adaptive",
    "time_limit": {
      "has_limit": false,
      "duration": "unlimited",
      "consequences": "none"
    },
    "failure_consequences": [
      "Temporary exhaustion and need to rest before retry",
      "Increased divine decay rate for 24 hours",
      "Companion becomes concerned and protective"
    ],
    "retry_policy": {
      "retries_allowed": "unlimited",
      "cooldown_period": "24 hours between attempts",
      "penalty_per_failure": "Slight increase in decay rate during cooldown"
    }
  },
  "choice_system": {
    "available_paths": [
      {
        "path_name": "Embrace the Forge",
        "philosophy": "Passionate creation through divine fire",
        "description": "Fully accept Pyrion's fire and use it to create something entirely new, demonstrating willingness to be transformed by divine passion",
        "challenge_variation": "Must forge a mystical item using pure divine fire while allowing it to change your very essence",
        "rewards": [
          "Enhanced fire resistance and affinity", 
          "Ability to channel creative passion more effectively",
          "Pyrion's mark of the Creative Flame"
        ]
      },
      {
        "path_name": "Master the Forge",
        "philosophy": "Controlled use of divine power",
        "description": "Demonstrate mastery over Pyrion's fire by using it as a tool while maintaining your own essential nature",
        "challenge_variation": "Must complete complex forging tasks that require precise control of divine fire without being overwhelmed",
        "rewards": [
          "Enhanced mystical crafting abilities",
          "Immunity to fire-based divine decay",
          "Pyrion's mark of the Master Smith"
        ]
      },
      {
        "path_name": "Transform the Forge",
        "philosophy": "Mutual evolution through cooperation",
        "description": "Work with Pyrion's fire to create something neither you nor the divine flame could achieve alone",
        "challenge_variation": "Must collaborate with the divine fire to forge something that transcends both mortal and divine limitations",
        "rewards": [
          "Unique hybrid abilities combining mortal creativity with divine power",
          "Special recognition from both Pyrion and other gods",
          "Pyrion's mark of the Divine Collaborator"
        ]
      }
    ],
    "choice_permanence": "permanent",
    "alignment_impact": {
      "god_relationship": "Establishes permanent relationship dynamic with Pyrion based on chosen path",
      "other_god_effects": [
        "Glacius may view fire-embracers with concern",
        "Voltharion respects mastery and control", 
        "Serafina appreciates collaborative approaches"
      ],
      "companion_reaction": "Companion's abilities may evolve to complement chosen relationship with fire",
      "social_standing": "Island inhabitants recognize the chosen path and adjust their interactions accordingly"
    }
  },
  "completion_rewards": {
    "divine_immunity": {
      "god_source": "pyrion",
      "protection_type": "Complete immunity to fire-based divine decay",
      "scope": "Pyrion's forge and all fire-dominant environments"
    },
    "power_increase": {
      "monster_level_boost": 6,
      "mystical_authority": "Recognized as divinely approved practitioner with fire authority",
      "ability_enhancements": [
        "Enhanced fire-based mystical abilities",
        "Improved crafting and creation skills",
        "Increased resistance to heat and flame"
      ]
    },
    "divine_marks": [
      {
        "mark_name": "Pyrion's Forge-Mark",
        "visual_appearance": "Glowing ember-like symbol on dominant hand that pulses with inner fire",
        "mystical_signature": "Distinctive fire-aspected energy signature recognizable to other practitioners",
        "social_recognition": "Immediately identifies bearer as Pyrion-approved to all inhabitants of fire-dominant areas"
      }
    ],
    "special_privileges": [
      "Access to divine forges and fire-based mystical resources",
      "Recognition by fire elementals and flame-aspected creatures",
      "Enhanced reputation with smiths, artisans, and creators"
    ]
  },
  "environmental_effects": {
    "decay_cessation": {
      "immediate_reversal": true,
      "healing_process": "Divine fire burns away all decay while strengthening the practitioner's form",
      "permanence": true
    },
    "seismic_response": {
      "tremor_intensity": "Moderate earthquake with heat-based vibrations",
      "duration": "45-60 seconds",
      "radius": "Entire Pyrion's Forge island",
      "mystical_signature": "Fire and creation energy signature recognizable as Pyrion's approval"
    },
    "divine_manifestation": {
      "god_appearance": true,
      "manifestation_type": "Pyrion briefly appears as a figure of living flame to acknowledge the achievement",
      "duration": "30-45 seconds",
      "witness_effects": "All witnesses gain temporary inspiration and enhanced creativity for 24 hours"
    }
  },
  "prerequisites": {
    "minimum_level": 6,
    "required_trials": [],
    "divine_decay_status": "required",
    "companion_requirement": true,
    "social_requirements": [
      "Must have arrived on Pyrion's Forge and experienced divine decay",
      "Companion must guide to trial location"
    ]
  },
  "companion_integration": {
    "companion_role": "guide",
    "companion_abilities": [
      "Can sense safe paths through divine fire",
      "Provides emotional support during intense moments",
      "May evolve fire-resistance or fire-affinity during trial"
    ],
    "bond_effects": [
      "Practitioner-companion bond strengthened through shared trial experience",
      "Companion gains immunity to Pyrion's influence alongside practitioner",
      "Enhanced communication through shared divine approval"
    ],
    "evolution_potential": true
  },
  "narrative_elements": {
    "thematic_focus": "The relationship between passion and creation, the nature of divine inspiration, and finding balance between being changed by power and maintaining personal identity",
    "moral_questions": [
      "Should one be transformed by divine power or seek to master it?",
      "What is the value of passionate creation versus controlled craftsmanship?",
      "How does accepting divine change affect one's essential self?"
    ],
    "character_development": "Forces practitioners to examine their relationship with passion, creativity, and divine power while establishing their fundamental approach to mystical practice",
    "world_building_elements": [
      "Reveals the nature of divine approval and its necessity for mystical stability",
      "Demonstrates Pyrion's personality and values through direct interaction",
      "Establishes the cosmic relationship between gods and mortals",
      "Shows how divine trials shape practitioner identity and capabilities"
    ]
  },
  "social_impact": {
    "community_recognition": "Pyrion's Forge inhabitants immediately recognize and respect trial completers as legitimate mystical practitioners",
    "religious_significance": "Seen as receiving Pyrion's personal blessing and approval, carrying significant spiritual weight",
    "economic_effects": [
      "Access to divine forges and fire-based mystical resources",
      "Enhanced reputation with crafting guilds and artisan communities",
      "Opportunities for high-level mystical crafting contracts"
    ],
    "political_implications": [
      "Recognition as legitimate mystical authority by island governance",
      "Potential leadership roles in fire-based mystical organizations",
      "Diplomatic weight when dealing with fire-aligned factions"
    ]
  },
  "related_content": {
    "associated_gods": ["pyrion"],
    "connected_trials": [
      "glacius-preserve-trial-of-preservation",
      "voltharion-peaks-trial-of-storms",
      "other-fundamental-god-trials"
    ],
    "relevant_locations": [
      "pyrion-forge-great-forge-chamber",
      "pyrion-forge-central-marketplace",
      "divine-fire-workshops"
    ],
    "key_npcs": [
      "forge-master-ignitus",
      "trial-witness-flame-speakers",
      "pyrion-approved-craftsmen"
    ]
  },
  "metadata": {
    "created": "2025-07-24T20:30:00Z",
    "last_updated": "2025-07-24T20:30:00Z",
    "author": "PrimalMyst Development Team",
    "version": "1.0.0",
    "canonical": true,
    "difficulty_rating": "beginner"
  }
}
